{
  "receipt_version": "3.0.0",
  "status": "generated",
  "reason": "",
  "artifact": {
    "path": "docs/standard_template_shell_neutrality_audit.md",
    "sha256": "53f4d7d52eac49f299c36f9986b7c0e7630e98cff5ee311ae228529cd346eefa",
    "output_schema": "text/markdown",
    "output_version": "markdown-v1"
  },
  "authoritative_inputs": [
    {
      "path": "templates/standard_stock_model_template.xlsx",
      "sha256": "f3d458e0536670635d704a804961956888123e04cb420d75fd8ff6261c471c74"
    },
    {
      "path": "docs/standard_template_shell_manifest.json",
      "sha256": "2d8102730d5279be43f23b0c97c9f6107304949d158b30b1f3699fcbf43167ab"
    },
    {
      "path": "docs/workbook_module_manifest.json",
      "sha256": "c439d0f8d62004f8612e4c6be0c91669eb4cad7bd5e7af33183e7b713fbcf32b"
    }
  ],
  "generator": {
    "contract_version": "1.0.0",
    "dependencies": [
      {
        "path": "pbi_xbrl/workbook_modules.py",
        "sha256": "15f1a9b4497ba0712de92815af40e91c0b0aa2fcac70e6c8b7a7df4b2cbc674b"
      },
      {
        "path": "pbi_xbrl/json_schema_validation.py",
        "sha256": "000e7f72c3faab206a135a416700fc235accfb2c533cbb90ddd2e5e886bedf28"
      }
    ],
    "execution_contract_sha256": "cbae89c807962a056e742328485f7d64f605fbd01f0ac67f45283b67623a14b2",
    "implementation_sha256": "5bc2e8b72415210e6ab2b487cd8eaad605818aa85a19c1ca02989d891ce3901c",
    "path": "scripts/build_standard_template_shell_neutrality_audit.py",
    "receipt_engine_sha256": "7a235734fe4851f27b7b5daf946b874f716d2a8e24eab75ab66c6069e39e3336",
    "runner_implementation_sha256": "a2d09fd4edefa35cbadb27ffbf3dd569c1bd3d0b306eaa12bd95555511b46291"
  },
  "verification": {
    "mode": "controlled_isolated_generator_run",
    "runner_contract_version": "2.0.0",
    "successful_completion": true,
    "run_generation_id": "10101307a3119e95dfcbca9c9af8a37346877d27f0b5d8d14c369c71772edae2",
    "generated_outputs": [
      {
        "canonical_content_sha256": "9bbd78e9a990ded8a1a6cc57765d4f24b64d8b1443c9990c8f1691a93033c5cb",
        "output_schema": "json",
        "output_version": "0.1.0",
        "path": "docs/standard_template_shell_neutrality_audit.json",
        "sha256": "52d3c1f5e9d214a43d582d86d52f141cd946b59efdaa18bf581ccc63ccf47c4a"
      },
      {
        "canonical_content_sha256": "2782c415fd4ee8eb496249daf3b395aa5fd48d63dbcca376574bc185467aa5cc",
        "output_schema": "text/markdown",
        "output_version": "markdown-v1",
        "path": "docs/standard_template_shell_neutrality_audit.md",
        "sha256": "53f4d7d52eac49f299c36f9986b7c0e7630e98cff5ee311ae228529cd346eefa"
      }
    ]
  },
  "generated_at_utc": "2026-07-19T11:27:32+00:00",
  "generation_id": "db5733a691c46598af0ad6ed328445ecfff53643dc2f028beac00941098f632c"
}
