{
  "receipt_version": "3.0.0",
  "status": "generated",
  "reason": "",
  "artifact": {
    "path": "docs/workbook_block_coverage_matrix.md",
    "sha256": "d93f8df06ce7bca7632ca5b1624208fb20fb7df61be0c4aa9fc59dd9b4e5e38c",
    "output_schema": "text/markdown",
    "output_version": "markdown-v1"
  },
  "authoritative_inputs": [
    {
      "path": "templates/lab/ANF_template_lab.xlsx",
      "sha256": "ef73bdef6b6efa1bc358622b58bfc320b609c128e76c602de9d4e5f726ab98cd"
    },
    {
      "path": "docs/standard_template_shell_manifest.json",
      "sha256": "4eece6b3258530ba21d0d65180757621f808983e30bb1fb179383021f00576c5"
    },
    {
      "path": "docs/workbook_binding_map.json",
      "sha256": "bee69cd7fcd4f0cd342863fba1f4a4619bb2ee669b42445911d361d2dc6047ac"
    },
    {
      "path": "docs/sheet_data_flow_map.json",
      "sha256": "af39ae96d4f7e2ace8c5cc1605fee2f07cd6c69150addb6ce20741f447fc6078"
    },
    {
      "path": "C:\\Users\\Jibbe\\Aktier\\StockModelData\\outputs\\Excel stock models\\PBI_model.xlsx",
      "sha256": "cf87600fbeeea285cf192f30520b1819bc4280ddbccd94c343828712d2020646"
    },
    {
      "path": "C:\\Users\\Jibbe\\Aktier\\StockModelData\\outputs\\Excel stock models\\GPRE_model.xlsm",
      "sha256": "f7c23c9c0d9e3a52c708553e5fc6f964aa3fc58c8b4805d235f7ccfce5bde41b"
    },
    {
      "path": "C:\\Users\\Jibbe\\Aktier\\StockModelData\\outputs\\Excel stock models\\ANF_model.xlsx",
      "sha256": "ef73bdef6b6efa1bc358622b58bfc320b609c128e76c602de9d4e5f726ab98cd"
    }
  ],
  "generator": {
    "contract_version": "1.0.0",
    "dependencies": [
      {
        "path": "pbi_xbrl/json_schema_validation.py",
        "sha256": "000e7f72c3faab206a135a416700fc235accfb2c533cbb90ddd2e5e886bedf28"
      }
    ],
    "execution_contract_sha256": "0fb39fbf730299788f9b9df975c32190c8b735c9e7d704bb765dec966f43527e",
    "implementation_sha256": "be97dce24dd2a7ae09f44504cac1bfcca345cdc773b947a057926b683e456415",
    "path": "scripts/build_workbook_block_architecture.py",
    "receipt_engine_sha256": "7a235734fe4851f27b7b5daf946b874f716d2a8e24eab75ab66c6069e39e3336",
    "runner_implementation_sha256": "a2d09fd4edefa35cbadb27ffbf3dd569c1bd3d0b306eaa12bd95555511b46291"
  },
  "verification": {
    "mode": "controlled_isolated_generator_run",
    "runner_contract_version": "2.0.0",
    "successful_completion": true,
    "run_generation_id": "3035e15f2ac4c94cfe0730d937e361f88614b4fac7497f74f2f367d0f93247b2",
    "generated_outputs": [
      {
        "canonical_content_sha256": "46895de9d58c821ecfd667682b8f172fc5b729fe0d1a0e7fddb20a569ce8bd1b",
        "output_schema": "json",
        "output_version": "0.1.0",
        "path": "docs/workbook_block_architecture.json",
        "sha256": "1de8711da5cd1b625656f02c0ecfa7095210d3b733c9eced263492de4c997c81"
      },
      {
        "canonical_content_sha256": "d1a6760f53155181c65065271207a2bf8070dcf2171837ed571029c4ab389fe6",
        "output_schema": "text/markdown",
        "output_version": "markdown-v1",
        "path": "docs/workbook_block_architecture.md",
        "sha256": "fb298d7a1faf21a28fb2a56f06b5263bf8c9f3fe33aff32d214a8c6faf930c83"
      },
      {
        "canonical_content_sha256": "fd94dcad39bb91d2a0e0fbfd00889913109bfbfa91d7a93342570a8c32ad6cb7",
        "output_schema": "json",
        "output_version": "0.1.0",
        "path": "docs/workbook_block_coverage_matrix.json",
        "sha256": "704094c5d28d1aa2f8af0d49e1e15c112bcf79bf231a8aee156c9b7007e21a31"
      },
      {
        "canonical_content_sha256": "f045d0b056fb4fd614e17e4b17f763644e18ecb220b438baf625381d85cb6dc6",
        "output_schema": "text/markdown",
        "output_version": "markdown-v1",
        "path": "docs/workbook_block_coverage_matrix.md",
        "sha256": "d93f8df06ce7bca7632ca5b1624208fb20fb7df61be0c4aa9fc59dd9b4e5e38c"
      }
    ]
  },
  "generated_at_utc": "2026-07-29T14:37:17+00:00",
  "generation_id": "40cff1da30f536de4eca544f2eab8489189d68afe55970b3886f0a1b29dce705"
}
