{
  "receipt_version": "3.0.0",
  "status": "stale",
  "reason": "Product Pass 3A2 adds debt product surfaces; manual visual audit is deferred to the integrated v8 render.",
  "artifact": {
    "path": "docs/standard_template_shell_visual_gap_audit.json",
    "sha256": "3c884c16dd604b435e6f595e49b17a1639167b985d10b87105393809457398f1",
    "output_schema": "json",
    "output_version": "0.1.0"
  },
  "authoritative_inputs": [
    {
      "path": "templates/standard_stock_model_template.xlsx",
      "sha256": "7a6fc3509d2b7f182c95b96cadf03767a7e7adc888d6ae57cda0d37e013fe29e"
    },
    {
      "path": "templates/lab/ANF_template_lab.xlsx",
      "sha256": "ef73bdef6b6efa1bc358622b58bfc320b609c128e76c602de9d4e5f726ab98cd"
    },
    {
      "path": "docs/standard_template_shell_manifest.json",
      "sha256": "1da4e344d036262c3bac1dc7fbbeeac53cc58c600b892542fc38b4bf2183f89f"
    }
  ],
  "generator": {
    "path": "scripts/build_standard_template_shell_visual_gap_audit.py",
    "contract_version": "1.0.0",
    "implementation_sha256": "40acaa66cae048b68baaffbc8f0902e5d2b6df46f3eb299d6e6a627de9cdd2ec",
    "receipt_engine_sha256": "7a235734fe4851f27b7b5daf946b874f716d2a8e24eab75ab66c6069e39e3336",
    "runner_implementation_sha256": "a2d09fd4edefa35cbadb27ffbf3dd569c1bd3d0b306eaa12bd95555511b46291",
    "execution_contract_sha256": "594167b5a91a4a2ecc056f5436b85053482b0a09e6cb6e222662fcedede12a4f",
    "dependencies": [
      {
        "path": "scripts/validate_standard_template_shell.py",
        "sha256": "5d5b59d7019dd786b7117e33fd930d0c5629dd46d0d9a8721bb190ec827b3773"
      }
    ]
  },
  "verification": {
    "mode": "unverified_stale",
    "runner_contract_version": "2.0.0",
    "successful_completion": false,
    "run_generation_id": "f473f680cc67a642b49c84c024d102e0f6313282e1c7193a135705bb53fd7c3d",
    "generated_outputs": []
  },
  "generated_at_utc": "2026-07-21T23:27:27+00:00",
  "generation_id": "6f0389aabbcc5a63e821444536202614f11651dae84aa5f3078027d5ad17302c"
}
