{
  "receipt_version": "3.0.0",
  "status": "generated",
  "reason": "",
  "artifact": {
    "path": "docs/workbook_block_architecture.md",
    "sha256": "b476a163485a4d57c904eb66e338f02fccda8047db3c77801ccee5f177f6f88c",
    "output_schema": "text/markdown",
    "output_version": "markdown-v1"
  },
  "authoritative_inputs": [
    {
      "path": "templates/lab/ANF_template_lab.xlsx",
      "sha256": "ef73bdef6b6efa1bc358622b58bfc320b609c128e76c602de9d4e5f726ab98cd"
    },
    {
      "path": "docs/standard_template_shell_manifest.json",
      "sha256": "b57a3afe3b5dc4dfaf68bb67769fc58f33224a64703fb4e784ad091fa430e7c6"
    },
    {
      "path": "docs/workbook_binding_map.json",
      "sha256": "f5ae60581645b6d5958f101e9634e2fc33da79e4efd440eaeedebc4b6530ada9"
    },
    {
      "path": "docs/sheet_data_flow_map.json",
      "sha256": "af39ae96d4f7e2ace8c5cc1605fee2f07cd6c69150addb6ce20741f447fc6078"
    },
    {
      "path": "C:\\Users\\Jibbe\\Aktier\\StockModelData\\outputs\\Excel stock models\\PBI_model.xlsx",
      "sha256": "cf87600fbeeea285cf192f30520b1819bc4280ddbccd94c343828712d2020646"
    },
    {
      "path": "C:\\Users\\Jibbe\\Aktier\\StockModelData\\outputs\\Excel stock models\\GPRE_model.xlsm",
      "sha256": "f7c23c9c0d9e3a52c708553e5fc6f964aa3fc58c8b4805d235f7ccfce5bde41b"
    },
    {
      "path": "C:\\Users\\Jibbe\\Aktier\\StockModelData\\outputs\\Excel stock models\\ANF_model.xlsx",
      "sha256": "ef73bdef6b6efa1bc358622b58bfc320b609c128e76c602de9d4e5f726ab98cd"
    }
  ],
  "generator": {
    "contract_version": "1.0.0",
    "dependencies": [
      {
        "path": "pbi_xbrl/json_schema_validation.py",
        "sha256": "000e7f72c3faab206a135a416700fc235accfb2c533cbb90ddd2e5e886bedf28"
      }
    ],
    "execution_contract_sha256": "0fb39fbf730299788f9b9df975c32190c8b735c9e7d704bb765dec966f43527e",
    "implementation_sha256": "be97dce24dd2a7ae09f44504cac1bfcca345cdc773b947a057926b683e456415",
    "path": "scripts/build_workbook_block_architecture.py",
    "receipt_engine_sha256": "7a235734fe4851f27b7b5daf946b874f716d2a8e24eab75ab66c6069e39e3336",
    "runner_implementation_sha256": "a2d09fd4edefa35cbadb27ffbf3dd569c1bd3d0b306eaa12bd95555511b46291"
  },
  "verification": {
    "mode": "controlled_isolated_generator_run",
    "runner_contract_version": "2.0.0",
    "successful_completion": true,
    "run_generation_id": "3ab6271e26a8d469bb6fcbe5b7cedffd6f27f4cdbc600f831ba016b3e2affb54",
    "generated_outputs": [
      {
        "canonical_content_sha256": "e00e668ee90d0a2ecca095492dadd28780a5ac3ca5d49cbfce946efaf5407633",
        "output_schema": "json",
        "output_version": "0.1.0",
        "path": "docs/workbook_block_architecture.json",
        "sha256": "9c8a35515adbb86b7ec54d0093c74c1ae65a88304b0a1b50e088f15c5a5a6c3e"
      },
      {
        "canonical_content_sha256": "9a26c728339f480c709d409a569ec4d6e9f3096b2d40adf79bf15a6d06428ad0",
        "output_schema": "text/markdown",
        "output_version": "markdown-v1",
        "path": "docs/workbook_block_architecture.md",
        "sha256": "b476a163485a4d57c904eb66e338f02fccda8047db3c77801ccee5f177f6f88c"
      },
      {
        "canonical_content_sha256": "6ad0dab64fa9c1be9d14f2a3687933d35afe0532d002a012a53a33d359ce5470",
        "output_schema": "json",
        "output_version": "0.1.0",
        "path": "docs/workbook_block_coverage_matrix.json",
        "sha256": "8553209e2df1a71252122be44a5b0e00b4e1cdfe07c1a800d8e791ba3fb2491c"
      },
      {
        "canonical_content_sha256": "1d6397a2a8aa8aa74c34d5b5ba61bbe62c5e0da3fe637a79173a053dbe64073c",
        "output_schema": "text/markdown",
        "output_version": "markdown-v1",
        "path": "docs/workbook_block_coverage_matrix.md",
        "sha256": "d9ca28881a623d5ff0b72bf5ef8fd7e392e78f172bf61730db61fabe48cefd47"
      }
    ]
  },
  "generated_at_utc": "2026-07-16T22:02:49+00:00",
  "generation_id": "5e3393dbaf2de64c22f3811fee3cae03e7af0664a225523be02a0a5ab7a91039"
}
