{
  "receipt_version": "3.0.0",
  "status": "generated",
  "reason": "",
  "artifact": {
    "path": "docs/standard_template_hidden_support_audit.json",
    "sha256": "054f6c358cbe9b8db9f6f5852f850e5db859f807af111df0cee6d4c8bb83dd29",
    "output_schema": "json",
    "output_version": "0.1.0"
  },
  "authoritative_inputs": [
    {
      "path": "templates/standard_stock_model_template.xlsx",
      "sha256": "7a6fc3509d2b7f182c95b96cadf03767a7e7adc888d6ae57cda0d37e013fe29e"
    },
    {
      "path": "templates/lab/ANF_template_lab.xlsx",
      "sha256": "ef73bdef6b6efa1bc358622b58bfc320b609c128e76c602de9d4e5f726ab98cd"
    },
    {
      "path": "docs/standard_template_shell_manifest.json",
      "sha256": "1da4e344d036262c3bac1dc7fbbeeac53cc58c600b892542fc38b4bf2183f89f"
    },
    {
      "path": "docs/workbook_module_manifest.json",
      "sha256": "89b88db8382b5ab975a01fc0283756a92a4214ccef31a5c91d635db86e8c2a02"
    }
  ],
  "generator": {
    "contract_version": "1.0.0",
    "dependencies": [
      {
        "path": "pbi_xbrl/workbook_modules.py",
        "sha256": "09c9793a50edb2836d241e53b9305935cfdbbf139a726aaa0629a1f07a8581a7"
      },
      {
        "path": "pbi_xbrl/json_schema_validation.py",
        "sha256": "000e7f72c3faab206a135a416700fc235accfb2c533cbb90ddd2e5e886bedf28"
      }
    ],
    "execution_contract_sha256": "42f4bb82287288c523b14b59b6eb3aca345d6fe8ba76283ae7780e03468a0147",
    "implementation_sha256": "34be4b7b6df058f8216ae7cf6a19d1ce93ab6e7266d0972c8d1371520bf5621f",
    "path": "scripts/build_standard_template_hidden_support_audit.py",
    "receipt_engine_sha256": "7a235734fe4851f27b7b5daf946b874f716d2a8e24eab75ab66c6069e39e3336",
    "runner_implementation_sha256": "a2d09fd4edefa35cbadb27ffbf3dd569c1bd3d0b306eaa12bd95555511b46291"
  },
  "verification": {
    "mode": "controlled_isolated_generator_run",
    "runner_contract_version": "2.0.0",
    "successful_completion": true,
    "run_generation_id": "4a0c793f56655d1eecd9a8958f3ddf23119315c458d758a2f28b7199206e060c",
    "generated_outputs": [
      {
        "canonical_content_sha256": "002d7e1da404ef78737f0ee4cf85e99a9f49036dd897469f2341322228a7599d",
        "output_schema": "json",
        "output_version": "0.1.0",
        "path": "docs/standard_template_hidden_support_audit.json",
        "sha256": "054f6c358cbe9b8db9f6f5852f850e5db859f807af111df0cee6d4c8bb83dd29"
      },
      {
        "canonical_content_sha256": "1f0fb95481d153ac42b9c0c1951e2d25c7c99a9dcf8c209c218f07992cd88591",
        "output_schema": "text/markdown",
        "output_version": "markdown-v1",
        "path": "docs/standard_template_hidden_support_audit.md",
        "sha256": "b3ad5ba7558844cf503e6ab2ecabcb30144fcab9f3928229ea90d0cb7306a0e3"
      }
    ]
  },
  "generated_at_utc": "2026-07-21T23:26:59+00:00",
  "generation_id": "f065e7c65ca9c21d0dc36dd4b84c177c99086c6678dba41318914ef11dac0dac"
}
