{
  "receipt_version": "3.0.0",
  "status": "generated",
  "reason": "",
  "artifact": {
    "path": "docs/support_sheet_lifecycle_contract.md",
    "sha256": "bb2e4fa71905a3647aa9a8c8d83cdfce4b5707180663f05afcddba983faa9d3b",
    "output_schema": "text/markdown",
    "output_version": "markdown-v1"
  },
  "authoritative_inputs": [
    {
      "path": "templates/standard_stock_model_template.xlsx",
      "sha256": "1a03e543d13b4ce7c5ab8c07cd11b3635197b806eb547bb8dd2ed962159d91b6"
    },
    {
      "path": "docs/standard_template_shell_manifest.json",
      "sha256": "43c4ab329acc26a671a3165da1dff70c63e72353b5c2676d76dfb8529acc8bea"
    },
    {
      "path": "docs/workbook_binding_map.json",
      "sha256": "7126d50ce908be2ad7653d1345ec5416d8b8a7ab7856331caf13fbcc8b58d18d"
    },
    {
      "path": "docs/workbook_module_manifest.json",
      "sha256": "cb1084b170f5d724b22e72aec4c037a4034f89520ca0be15fd8acca30d4cf73f"
    },
    {
      "path": "C:\\Users\\Jibbe\\Aktier\\StockModelData\\outputs\\Excel stock models\\PBI_model.xlsx",
      "sha256": "cf87600fbeeea285cf192f30520b1819bc4280ddbccd94c343828712d2020646"
    },
    {
      "path": "C:\\Users\\Jibbe\\Aktier\\StockModelData\\outputs\\Excel stock models\\GPRE_model.xlsm",
      "sha256": "f7c23c9c0d9e3a52c708553e5fc6f964aa3fc58c8b4805d235f7ccfce5bde41b"
    },
    {
      "path": "C:\\Users\\Jibbe\\Aktier\\StockModelData\\outputs\\Excel stock models\\ANF_model.xlsx",
      "sha256": "ef73bdef6b6efa1bc358622b58bfc320b609c128e76c602de9d4e5f726ab98cd"
    }
  ],
  "generator": {
    "contract_version": "1.0.0",
    "dependencies": [
      {
        "path": "pbi_xbrl/workbook_modules.py",
        "sha256": "53460f877d441ebc64a762af19cd07b74468479397f5802f2411596cd7225f77"
      },
      {
        "path": "pbi_xbrl/json_schema_validation.py",
        "sha256": "000e7f72c3faab206a135a416700fc235accfb2c533cbb90ddd2e5e886bedf28"
      }
    ],
    "execution_contract_sha256": "79921e717c418416abdafec570ab6f4530ecbf9a52b9412b1f630175bd51c3c5",
    "implementation_sha256": "0d66f7be39aef99cc5f63e568f301525055a45c2a4679cc53cd92ae7adbdb379",
    "path": "scripts/build_standard_template_sheet_inventory.py",
    "receipt_engine_sha256": "7a235734fe4851f27b7b5daf946b874f716d2a8e24eab75ab66c6069e39e3336",
    "runner_implementation_sha256": "a2d09fd4edefa35cbadb27ffbf3dd569c1bd3d0b306eaa12bd95555511b46291"
  },
  "verification": {
    "mode": "controlled_isolated_generator_run",
    "runner_contract_version": "2.0.0",
    "successful_completion": true,
    "run_generation_id": "b25ad6151e33c47fa06c1984299a443c14a29e4ffa8a5f3bf2f66ff822c1c004",
    "generated_outputs": [
      {
        "canonical_content_sha256": "f2d6cdfd16733bcf7b5d18cf8ad7f3bff21b9af7d8eebcbe02d7079e43e38e63",
        "output_schema": "json",
        "output_version": "0.1.0",
        "path": "docs/standard_template_sheet_inventory.json",
        "sha256": "d057d9595a08451d7acf059d60d6af080ef2b994b57bc43896a7587a239e2b26"
      },
      {
        "canonical_content_sha256": "f169b7e3b0e911d0ce14a72fbf26842f5c9f073e9e54f77e4028e0ddec9c425b",
        "output_schema": "text/markdown",
        "output_version": "markdown-v1",
        "path": "docs/standard_template_sheet_inventory.md",
        "sha256": "c8a284fbde1cecb07c8cc8dc478374188ecfeb1cc92994e0c1fd46dcffb88744"
      },
      {
        "canonical_content_sha256": "ae77ff782cd2ba1400112d2788a9878db7a3ad06c31e80ce6667246fc8886877",
        "output_schema": "json",
        "output_version": "0.1.0",
        "path": "docs/support_sheet_lifecycle_contract.json",
        "sha256": "659270fdf6c22850b8b5703656d401de58a3f4f3b071a8891a4049e6fd8fa490"
      },
      {
        "canonical_content_sha256": "ece9665408f5ae4175154f5a0895e3ccb46d5aebd90792f6a75679ceab5fb083",
        "output_schema": "text/markdown",
        "output_version": "markdown-v1",
        "path": "docs/support_sheet_lifecycle_contract.md",
        "sha256": "bb2e4fa71905a3647aa9a8c8d83cdfce4b5707180663f05afcddba983faa9d3b"
      }
    ]
  },
  "generated_at_utc": "2026-07-15T21:23:19+00:00",
  "generation_id": "218740f56d5048faa372f433e7ed2465d5a9ae22b70ba4fcc4f3fd946e515897"
}
