{
  "receipt_version": "3.0.0",
  "status": "generated",
  "reason": "",
  "artifact": {
    "path": "docs/standard_template_defined_name_audit.json",
    "sha256": "f7af895f9d3d95a7052a6155b7a276d3003e7920aff4368d3bb11b44dc83b7d3",
    "output_schema": "json",
    "output_version": "1.0.0"
  },
  "authoritative_inputs": [
    {
      "path": "templates/standard_stock_model_template.xlsx",
      "sha256": "c7406134ecfcb1c795f0766f3ed24c07fd53fe875c65eab4f066800572d11e4a"
    },
    {
      "path": "docs/standard_template_shell_manifest.json",
      "sha256": "d56fca7e920a52595551542cac18fb7f8ba21157bed4aabfe344d5d6e7d54ed1"
    },
    {
      "path": "docs/workbook_binding_map.json",
      "sha256": "5e18ba698aaeb81a7088ba73df2fa7e6fa4b1d22fa4183156bd01b486546e5f5"
    }
  ],
  "generator": {
    "contract_version": "1.0.0",
    "dependencies": [],
    "execution_contract_sha256": "9e2ee33a8c37601c6a8b1ee1949ebfc0d91e00660ff6b11802af03cbb93b1925",
    "implementation_sha256": "9ccfc5fcaccc4b8139e448f1e7b12bbdee5b3ea28ec4e28f95a13f2003ba0a7f",
    "path": "scripts/build_standard_template_defined_name_audit.py",
    "receipt_engine_sha256": "d8dcde2700b5d5b2a8bbb4040b5341995408745ac09ff0559b3dd979593c5be0",
    "runner_implementation_sha256": "a2d09fd4edefa35cbadb27ffbf3dd569c1bd3d0b306eaa12bd95555511b46291"
  },
  "verification": {
    "mode": "controlled_isolated_generator_run",
    "runner_contract_version": "2.0.0",
    "successful_completion": true,
    "run_generation_id": "a5a358c51d09101a1e4a0f6585c3ebd5fd630ad5f5941da163985c939edc643e",
    "generated_outputs": [
      {
        "canonical_content_sha256": "24500a8691db2314ee1cce0613542fa60b77f04c2b5b68b9273f56cdd28b012c",
        "output_schema": "json",
        "output_version": "1.0.0",
        "path": "docs/standard_template_defined_name_audit.json",
        "sha256": "f7af895f9d3d95a7052a6155b7a276d3003e7920aff4368d3bb11b44dc83b7d3"
      },
      {
        "canonical_content_sha256": "77185c3efdebafd1e364c076a54e0abf9f6a9494fe65808a6749d623f72de9ba",
        "output_schema": "text/markdown",
        "output_version": "markdown-v1",
        "path": "docs/standard_template_defined_name_audit.md",
        "sha256": "d219e8881b79119bb17b433de7837fef31830b28783c31979fdc666484f57b25"
      }
    ]
  },
  "generated_at_utc": "2026-07-14T20:43:34+00:00",
  "generation_id": "c879703da4236cb04a1ec6906c58c6465c4d098fc6aeba83f9a25518a3c135d6"
}
