{
  "receipt_version": "3.0.0",
  "status": "generated",
  "reason": "",
  "artifact": {
    "path": "docs/support_sheet_lifecycle_contract.json",
    "sha256": "33f8bb55e687470cbe2f7a872088f1909d09da5d461331fd3f604bb6a66ae773",
    "output_schema": "json",
    "output_version": "0.1.0"
  },
  "authoritative_inputs": [
    {
      "path": "templates/standard_stock_model_template.xlsx",
      "sha256": "48b3c4eb7d5e297801256d0e2c798faa7d98ea2369b81fa231cde9ceaa02fa67"
    },
    {
      "path": "docs/standard_template_shell_manifest.json",
      "sha256": "71d3db661ac4161ce4a647667e6d50a7286a04efd559af1232bd80cc76d549c9"
    },
    {
      "path": "docs/workbook_binding_map.json",
      "sha256": "cf1195e9954125a051f534aa2da69e45c6a3b33bc3eac4e8b0c05ba0b4f829d2"
    },
    {
      "path": "docs/workbook_module_manifest.json",
      "sha256": "44f68798771288fcaeb17a6110c8e53969d84939fed3b62dbe9882296da849d9"
    },
    {
      "path": "C:\\Users\\Jibbe\\Aktier\\StockModelData\\outputs\\Excel stock models\\PBI_model.xlsx",
      "sha256": "cf87600fbeeea285cf192f30520b1819bc4280ddbccd94c343828712d2020646"
    },
    {
      "path": "C:\\Users\\Jibbe\\Aktier\\StockModelData\\outputs\\Excel stock models\\GPRE_model.xlsm",
      "sha256": "f7c23c9c0d9e3a52c708553e5fc6f964aa3fc58c8b4805d235f7ccfce5bde41b"
    },
    {
      "path": "C:\\Users\\Jibbe\\Aktier\\StockModelData\\outputs\\Excel stock models\\ANF_model.xlsx",
      "sha256": "ef73bdef6b6efa1bc358622b58bfc320b609c128e76c602de9d4e5f726ab98cd"
    }
  ],
  "generator": {
    "contract_version": "1.0.0",
    "dependencies": [
      {
        "path": "pbi_xbrl/workbook_modules.py",
        "sha256": "d9fbdd3c22454c0e08eaa740da1d4969c830deb399c5a5d58fd46ac5ecdeb52f"
      },
      {
        "path": "pbi_xbrl/json_schema_validation.py",
        "sha256": "000e7f72c3faab206a135a416700fc235accfb2c533cbb90ddd2e5e886bedf28"
      }
    ],
    "execution_contract_sha256": "79921e717c418416abdafec570ab6f4530ecbf9a52b9412b1f630175bd51c3c5",
    "implementation_sha256": "0d66f7be39aef99cc5f63e568f301525055a45c2a4679cc53cd92ae7adbdb379",
    "path": "scripts/build_standard_template_sheet_inventory.py",
    "receipt_engine_sha256": "7a235734fe4851f27b7b5daf946b874f716d2a8e24eab75ab66c6069e39e3336",
    "runner_implementation_sha256": "a2d09fd4edefa35cbadb27ffbf3dd569c1bd3d0b306eaa12bd95555511b46291"
  },
  "verification": {
    "mode": "controlled_isolated_generator_run",
    "runner_contract_version": "2.0.0",
    "successful_completion": true,
    "run_generation_id": "7a056f0508fe2b62507dfda04a4a609b399128bc2a58909ac9d96e8ff248016b",
    "generated_outputs": [
      {
        "canonical_content_sha256": "6c7eb4ddc97d8a59070d8aafd67d139a55298c221595c9bc213c85f275b3183f",
        "output_schema": "json",
        "output_version": "0.1.0",
        "path": "docs/standard_template_sheet_inventory.json",
        "sha256": "b255b02d23e31b0601728bfb865de89af06a3d9e8cffc7915bc7f842d350fb23"
      },
      {
        "canonical_content_sha256": "f169b7e3b0e911d0ce14a72fbf26842f5c9f073e9e54f77e4028e0ddec9c425b",
        "output_schema": "text/markdown",
        "output_version": "markdown-v1",
        "path": "docs/standard_template_sheet_inventory.md",
        "sha256": "c8a284fbde1cecb07c8cc8dc478374188ecfeb1cc92994e0c1fd46dcffb88744"
      },
      {
        "canonical_content_sha256": "887277ea9310c56c4bef8d6e2dba55036f012b8562003a6f9cd792d6a2bab32e",
        "output_schema": "json",
        "output_version": "0.1.0",
        "path": "docs/support_sheet_lifecycle_contract.json",
        "sha256": "33f8bb55e687470cbe2f7a872088f1909d09da5d461331fd3f604bb6a66ae773"
      },
      {
        "canonical_content_sha256": "ece9665408f5ae4175154f5a0895e3ccb46d5aebd90792f6a75679ceab5fb083",
        "output_schema": "text/markdown",
        "output_version": "markdown-v1",
        "path": "docs/support_sheet_lifecycle_contract.md",
        "sha256": "bb2e4fa71905a3647aa9a8c8d83cdfce4b5707180663f05afcddba983faa9d3b"
      }
    ]
  },
  "generated_at_utc": "2026-07-29T08:47:54+00:00",
  "generation_id": "a345ce2a2773591e2d8de6e97bb1a87c2b21628df2775a0f70d580fc187e14db"
}
