{
  "receipt_version": "3.0.0",
  "status": "generated",
  "reason": "",
  "artifact": {
    "path": "docs/standard_template_hidden_support_audit.md",
    "sha256": "ab10ad2566843e333d553accd82ab7791f5a7ca265488f73a6622166c6abcb0a",
    "output_schema": "text/markdown",
    "output_version": "markdown-v1"
  },
  "authoritative_inputs": [
    {
      "path": "templates/standard_stock_model_template.xlsx",
      "sha256": "03a2c2c3d8e55cb3a0e1ddca7905ffe132220743763ce691ca69dbe5418650a5"
    },
    {
      "path": "templates/lab/ANF_template_lab.xlsx",
      "sha256": "ef73bdef6b6efa1bc358622b58bfc320b609c128e76c602de9d4e5f726ab98cd"
    },
    {
      "path": "docs/standard_template_shell_manifest.json",
      "sha256": "5e00b256403592d54f05918cd8eb04edbab793ee6f9828d20b4481aefe630ded"
    },
    {
      "path": "docs/workbook_module_manifest.json",
      "sha256": "809652b6d681a147fc52de0c0b4d769d105598af606d2770f89ea60f3c7e0ac1"
    }
  ],
  "generator": {
    "contract_version": "1.0.0",
    "dependencies": [
      {
        "path": "pbi_xbrl/workbook_modules.py",
        "sha256": "602a95c1e6366e5c201735d0197cbf6abc6d107190df5dad40da8c49a75e7eb0"
      },
      {
        "path": "pbi_xbrl/json_schema_validation.py",
        "sha256": "000e7f72c3faab206a135a416700fc235accfb2c533cbb90ddd2e5e886bedf28"
      }
    ],
    "execution_contract_sha256": "42f4bb82287288c523b14b59b6eb3aca345d6fe8ba76283ae7780e03468a0147",
    "implementation_sha256": "34be4b7b6df058f8216ae7cf6a19d1ce93ab6e7266d0972c8d1371520bf5621f",
    "path": "scripts/build_standard_template_hidden_support_audit.py",
    "receipt_engine_sha256": "7a235734fe4851f27b7b5daf946b874f716d2a8e24eab75ab66c6069e39e3336",
    "runner_implementation_sha256": "a2d09fd4edefa35cbadb27ffbf3dd569c1bd3d0b306eaa12bd95555511b46291"
  },
  "verification": {
    "mode": "controlled_isolated_generator_run",
    "runner_contract_version": "2.0.0",
    "successful_completion": true,
    "run_generation_id": "74505df7854ddc7a43e666a22ca9a7dd4f3f94e5556bd440230caaeaf70b53c6",
    "generated_outputs": [
      {
        "canonical_content_sha256": "7be17245bb168a04a8376d7b722585791154da47ec2f8c3b3d7a785ffed02ea1",
        "output_schema": "json",
        "output_version": "0.1.0",
        "path": "docs/standard_template_hidden_support_audit.json",
        "sha256": "4a9b7588efdee018b5bd0874ed2e82c4a464538c8741c832d7d0d2d4c7d49cbb"
      },
      {
        "canonical_content_sha256": "1792cb70a8ed131c14e5a0cf19a1b91f1494513dfc0070b668646f4519a3f7ae",
        "output_schema": "text/markdown",
        "output_version": "markdown-v1",
        "path": "docs/standard_template_hidden_support_audit.md",
        "sha256": "ab10ad2566843e333d553accd82ab7791f5a7ca265488f73a6622166c6abcb0a"
      }
    ]
  },
  "generated_at_utc": "2026-07-18T07:49:21+00:00",
  "generation_id": "b15da809007641eec9ba33e756ae16f434f616ea650dacc7088c02c639646622"
}
