{
  "receipt_version": "3.0.0",
  "status": "generated",
  "reason": "",
  "artifact": {
    "path": "docs/standard_template_shell_neutrality_audit.json",
    "sha256": "92c3aaeec690216a623cce8ac29b545316e09c3fec5a6fb93da050a3c70e89cb",
    "output_schema": "json",
    "output_version": "0.1.0"
  },
  "authoritative_inputs": [
    {
      "path": "templates/standard_stock_model_template.xlsx",
      "sha256": "1a03e543d13b4ce7c5ab8c07cd11b3635197b806eb547bb8dd2ed962159d91b6"
    },
    {
      "path": "docs/standard_template_shell_manifest.json",
      "sha256": "43c4ab329acc26a671a3165da1dff70c63e72353b5c2676d76dfb8529acc8bea"
    },
    {
      "path": "docs/workbook_module_manifest.json",
      "sha256": "cb1084b170f5d724b22e72aec4c037a4034f89520ca0be15fd8acca30d4cf73f"
    }
  ],
  "generator": {
    "contract_version": "1.0.0",
    "dependencies": [
      {
        "path": "pbi_xbrl/workbook_modules.py",
        "sha256": "53460f877d441ebc64a762af19cd07b74468479397f5802f2411596cd7225f77"
      },
      {
        "path": "pbi_xbrl/json_schema_validation.py",
        "sha256": "000e7f72c3faab206a135a416700fc235accfb2c533cbb90ddd2e5e886bedf28"
      }
    ],
    "execution_contract_sha256": "cbae89c807962a056e742328485f7d64f605fbd01f0ac67f45283b67623a14b2",
    "implementation_sha256": "5bc2e8b72415210e6ab2b487cd8eaad605818aa85a19c1ca02989d891ce3901c",
    "path": "scripts/build_standard_template_shell_neutrality_audit.py",
    "receipt_engine_sha256": "7a235734fe4851f27b7b5daf946b874f716d2a8e24eab75ab66c6069e39e3336",
    "runner_implementation_sha256": "a2d09fd4edefa35cbadb27ffbf3dd569c1bd3d0b306eaa12bd95555511b46291"
  },
  "verification": {
    "mode": "controlled_isolated_generator_run",
    "runner_contract_version": "2.0.0",
    "successful_completion": true,
    "run_generation_id": "21e90ebe7480e8320ba55b4269dd3b1882e94716406331f1bb64281987a3dfeb",
    "generated_outputs": [
      {
        "canonical_content_sha256": "e14713b969650fe2218be88184ae0954afd61967b39f731c69df3c835e936077",
        "output_schema": "json",
        "output_version": "0.1.0",
        "path": "docs/standard_template_shell_neutrality_audit.json",
        "sha256": "92c3aaeec690216a623cce8ac29b545316e09c3fec5a6fb93da050a3c70e89cb"
      },
      {
        "canonical_content_sha256": "2c69d5c3eb2053ef9913af5a18389e7131daae90526cdc273d98448bbee0cb89",
        "output_schema": "text/markdown",
        "output_version": "markdown-v1",
        "path": "docs/standard_template_shell_neutrality_audit.md",
        "sha256": "7cbd73d70c662721f0bac026990b9e270ce84ab19d84885e0bc89f006aec70ac"
      }
    ]
  },
  "generated_at_utc": "2026-07-15T21:23:25+00:00",
  "generation_id": "142890fc9aae1a156593af0a26c8e0247a2ebd90690f8080b69c32376fda708c"
}
