{
  "receipt_version": "3.0.0",
  "status": "generated",
  "reason": "",
  "artifact": {
    "path": "docs/standard_template_sheet_inventory.json",
    "sha256": "5dedc6563631d6d43bf5daf5fbbda4aa803ea9c55ec452d6d54de7f325400eae",
    "output_schema": "json",
    "output_version": "0.1.0"
  },
  "authoritative_inputs": [
    {
      "path": "templates/standard_stock_model_template.xlsx",
      "sha256": "8cc97f138cf1c4e9cf1331d611cbdb4a2f89cf5ca6f9876840031e5b54776d49"
    },
    {
      "path": "docs/standard_template_shell_manifest.json",
      "sha256": "29b521170e14c3996f1aace9cc9d2bcb152ab3711b4785a438360d9413c0230b"
    },
    {
      "path": "docs/workbook_binding_map.json",
      "sha256": "13eb6f906f2f18734c2730d422ce4b64720a89ac03c81705c583f0c0b5f589e6"
    },
    {
      "path": "docs/workbook_module_manifest.json",
      "sha256": "9b8f0fa7f2e7b87c1bcf93f31b8b512bee05f5fdd00e320d36b9c3b895ce2995"
    },
    {
      "path": "C:\\Users\\Jibbe\\Aktier\\StockModelData\\outputs\\Excel stock models\\PBI_model.xlsx",
      "sha256": "cf87600fbeeea285cf192f30520b1819bc4280ddbccd94c343828712d2020646"
    },
    {
      "path": "C:\\Users\\Jibbe\\Aktier\\StockModelData\\outputs\\Excel stock models\\GPRE_model.xlsm",
      "sha256": "f7c23c9c0d9e3a52c708553e5fc6f964aa3fc58c8b4805d235f7ccfce5bde41b"
    },
    {
      "path": "C:\\Users\\Jibbe\\Aktier\\StockModelData\\outputs\\Excel stock models\\ANF_model.xlsx",
      "sha256": "ef73bdef6b6efa1bc358622b58bfc320b609c128e76c602de9d4e5f726ab98cd"
    }
  ],
  "generator": {
    "contract_version": "1.0.0",
    "dependencies": [
      {
        "path": "pbi_xbrl/workbook_modules.py",
        "sha256": "d9fbdd3c22454c0e08eaa740da1d4969c830deb399c5a5d58fd46ac5ecdeb52f"
      },
      {
        "path": "pbi_xbrl/json_schema_validation.py",
        "sha256": "000e7f72c3faab206a135a416700fc235accfb2c533cbb90ddd2e5e886bedf28"
      }
    ],
    "execution_contract_sha256": "79921e717c418416abdafec570ab6f4530ecbf9a52b9412b1f630175bd51c3c5",
    "implementation_sha256": "0d66f7be39aef99cc5f63e568f301525055a45c2a4679cc53cd92ae7adbdb379",
    "path": "scripts/build_standard_template_sheet_inventory.py",
    "receipt_engine_sha256": "7a235734fe4851f27b7b5daf946b874f716d2a8e24eab75ab66c6069e39e3336",
    "runner_implementation_sha256": "a2d09fd4edefa35cbadb27ffbf3dd569c1bd3d0b306eaa12bd95555511b46291"
  },
  "verification": {
    "mode": "controlled_isolated_generator_run",
    "runner_contract_version": "2.0.0",
    "successful_completion": true,
    "run_generation_id": "d032be91cbaaaaf4d47a8ee0474e135d4054b4885b66d9fce47c2ae610fc33fe",
    "generated_outputs": [
      {
        "canonical_content_sha256": "1f9431005fdab05a15cd6c82c904f2ea76b17d07a2f36b8a2e566eb7b82f6f36",
        "output_schema": "json",
        "output_version": "0.1.0",
        "path": "docs/standard_template_sheet_inventory.json",
        "sha256": "5dedc6563631d6d43bf5daf5fbbda4aa803ea9c55ec452d6d54de7f325400eae"
      },
      {
        "canonical_content_sha256": "f169b7e3b0e911d0ce14a72fbf26842f5c9f073e9e54f77e4028e0ddec9c425b",
        "output_schema": "text/markdown",
        "output_version": "markdown-v1",
        "path": "docs/standard_template_sheet_inventory.md",
        "sha256": "c8a284fbde1cecb07c8cc8dc478374188ecfeb1cc92994e0c1fd46dcffb88744"
      },
      {
        "canonical_content_sha256": "77de5214abcfb6a944679eb16b773997a3e72c61e2a87cdb37f50deeadd5b210",
        "output_schema": "json",
        "output_version": "0.1.0",
        "path": "docs/support_sheet_lifecycle_contract.json",
        "sha256": "23b7b49c4d70704e74e48fea52c1739e250c0158afa0119a7962e2056d495c3c"
      },
      {
        "canonical_content_sha256": "ece9665408f5ae4175154f5a0895e3ccb46d5aebd90792f6a75679ceab5fb083",
        "output_schema": "text/markdown",
        "output_version": "markdown-v1",
        "path": "docs/support_sheet_lifecycle_contract.md",
        "sha256": "bb2e4fa71905a3647aa9a8c8d83cdfce4b5707180663f05afcddba983faa9d3b"
      }
    ]
  },
  "generated_at_utc": "2026-07-26T13:34:52+00:00",
  "generation_id": "3ced517a73501a591af4d8cc3939636ee84276ae7850d7fc5eeaca489275d570"
}
