{
  "receipt_version": "3.0.0",
  "status": "generated",
  "reason": "",
  "artifact": {
    "path": "docs/standard_template_shell_visual_gap_audit.md",
    "sha256": "f79d47dbcabbd6562bc106273a4f692393b92c0d74b156c1963d6c3dbb82684a",
    "output_schema": "text/markdown",
    "output_version": "markdown-v1"
  },
  "authoritative_inputs": [
    {
      "path": "templates/standard_stock_model_template.xlsx",
      "sha256": "8cc97f138cf1c4e9cf1331d611cbdb4a2f89cf5ca6f9876840031e5b54776d49"
    },
    {
      "path": "templates/lab/ANF_template_lab.xlsx",
      "sha256": "ef73bdef6b6efa1bc358622b58bfc320b609c128e76c602de9d4e5f726ab98cd"
    },
    {
      "path": "docs/standard_template_shell_manifest.json",
      "sha256": "29b521170e14c3996f1aace9cc9d2bcb152ab3711b4785a438360d9413c0230b"
    }
  ],
  "generator": {
    "contract_version": "1.0.0",
    "dependencies": [
      {
        "path": "scripts/validate_standard_template_shell.py",
        "sha256": "7dbd0090aedecbd4c5659a9e6516f13f9457af6ea8dfbefcadb27379bdfd4946"
      }
    ],
    "execution_contract_sha256": "594167b5a91a4a2ecc056f5436b85053482b0a09e6cb6e222662fcedede12a4f",
    "implementation_sha256": "23e43dcdc6901aae89e9f17985c3efd16a926c851099b1abbc7f674c7e79122d",
    "path": "scripts/build_standard_template_shell_visual_gap_audit.py",
    "receipt_engine_sha256": "7a235734fe4851f27b7b5daf946b874f716d2a8e24eab75ab66c6069e39e3336",
    "runner_implementation_sha256": "a2d09fd4edefa35cbadb27ffbf3dd569c1bd3d0b306eaa12bd95555511b46291"
  },
  "verification": {
    "mode": "controlled_isolated_generator_run",
    "runner_contract_version": "2.0.0",
    "successful_completion": true,
    "run_generation_id": "24f7269c46401f551e2b02b2016bba47781e951babf718f610d7c8bf9db4765d",
    "generated_outputs": [
      {
        "canonical_content_sha256": "f555b7823ceb705fb0043740302fb2448a38bb78ed11a2e48724fa26a4608824",
        "output_schema": "json",
        "output_version": "0.1.0",
        "path": "docs/standard_template_shell_visual_gap_audit.json",
        "sha256": "6733c4d41a655acf407e6a54a2226a28260f42c749ec76657678bd3c9f249693"
      },
      {
        "canonical_content_sha256": "02d640f343f233ad025dd56b4df77169b465b5ff51131e89c18a9934d861ed33",
        "output_schema": "text/markdown",
        "output_version": "markdown-v1",
        "path": "docs/standard_template_shell_visual_gap_audit.md",
        "sha256": "f79d47dbcabbd6562bc106273a4f692393b92c0d74b156c1963d6c3dbb82684a"
      }
    ]
  },
  "generated_at_utc": "2026-07-26T13:38:09+00:00",
  "generation_id": "9089cc3a8479d45f3f57729096c35dd219778e22fa72a2fe0fb678051f092af7"
}
